### ISSUE TITLE
Automatic update: 

### ISSUE THREAD

**Issue by GoogleCodeExporter** [rheostat2718/conemu-maximus5#1363]
```
Required information!
OS version: Win7   SP1   x64
ConEmu version: 131020 [64]
Far version (if you are using Far Manager): N/A

*Bug description*
Conemu auto update download fails with the following error:

---------------------------
Windows PowerShell
---------------------------
HttpSendRequest failed
URL=http://conemu-maximus5.googlecode.com/files/ConEmuSetup.131119.exe
code=12002
---------------------------
OK   
---------------------------


*Steps to reproduction*
1. Ensure that Conemu is configured to update automatically.
  * Update Settings: [X]Check on Startup [ ]Hourly [ ]Show TSA baloon ( )Stable ( )Preview (*)Latest
2. Launch ConEmu
3. When prompted to download new update, click the Yes button.

Expected behavior:
  Download completes and auto update process begins

Actual behavior:
  The download fails with the above error message.


Wireshark shows that there is no response to the HTTP request for the 
installer. Strangely, however, I was able to download the file with a browser 
at the same URI with no problem.

172.20.205.128 -> 173.194.74.82 51544 > http [SYN] Seq=0 Win=8192 Len=0 
MSS=1460 WS=256 SACK_PERM=1
173.194.74.82 -> 172.20.205.128 http > 51544 [SYN, ACK] Seq=0 Ack=1 Win=62920 
Len=0 MSS=1380 SACK_PERM=1 WS=64
172.20.205.128 -> 173.194.74.82 51544 > http [ACK] Seq=1 Ack=1 Win=66048 Len=0
172.20.205.128 -> 173.194.74.82 GET /svn/trunk/ConEmu/version.ini HTTP/1.1
173.194.74.82 -> 172.20.205.128 http > 51544 [ACK] Seq=1 Ack=187 Win=64000 Len=0
173.194.74.82 -> 172.20.205.128 HTTP/1.1 200 OK  (text/plain)
172.20.205.128 -> 173.194.74.82 51544 > http [ACK] Seq=187 Ack=1038 Win=65024 
Len=0
172.20.205.128 -> 173.194.74.82 GET /files/ConEmuSetup.131119.exe HTTP/1.1
172.20.205.128 -> 173.194.74.82 [TCP Retransmission] GET 
/files/ConEmuSetup.131119.exe HTTP/1.1
172.20.205.128 -> 173.194.74.82 [TCP Retransmission] GET 
/files/ConEmuSetup.131119.exe HTTP/1.1
172.20.205.128 -> 173.194.74.82 [TCP Retransmission] GET 
/files/ConEmuSetup.131119.exe HTTP/1.1
172.20.205.128 -> 173.194.74.82 [TCP Retransmission] GET 
/files/ConEmuSetup.131119.exe HTTP/1.1
172.20.205.128 -> 173.194.74.82 [TCP Retransmission] GET 
/files/ConEmuSetup.131119.exe HTTP/1.1
172.20.205.128 -> 173.194.74.82 [TCP Retransmission] GET 
/files/ConEmuSetup.131119.exe HTTP/1.1
172.20.205.128 -> 173.194.74.82 [TCP Retransmission] GET 
/files/ConEmuSetup.131119.exe HTTP/1.1
172.20.205.128 -> 173.194.74.82 51544 > http [RST, ACK] Seq=373 Ack=1038 Win=0 
Len=0
```

Original issue reported on code.google.com by `br...@digital-traffic.net` on 22 Nov 2013 at 8:22
